,case_number,country,area,location,sex_,age,species_,siglo,injury,date,mes,fatal_(y/n)_limpio,sex,country_,year
0,2018.06.25,usa,California,"Oceanside, San Diego County",F,57,White shark,siglo XXI,"No injury to occupant, outrigger canoe and paddle damaged",25-Jun-2018,Jun,N,F,usa,2018.0
1,2018.06.03.a,brazil,Pernambuco,"Piedade Beach, Recife",M,18,Tiger shark,siglo XXI,FATAL,03-Jun-2018,Jun,Y,M,brazil,2018.0
2,2018.05.26.b,usa,Florida,"Cocoa Beach, Brevard  County",M,15,"Bull shark, 6'",siglo XXI,Lower left leg bitten,26-May-2018,May,N,M,usa,2018.0
3,2018.05.24,australia,Queensland,Cairns Aquarium,M,32,Grey reef shark,siglo XXI,Minor bite to hand by captive shark. PROVOKED INCIDENT,24-May-2018,May,N,M,australia,2018.0
4,2018.05.13.a,england,Cornwall,Off Land's End,M,21,Invalid incident,siglo XXI,Injured by teeth of a dead porbeagle shark he was tossing overboard.,13-May-2018,May,N,M,england,2018.0
5,2018.04.28.b,costa rica,Cocos Island,Manuelita,M,30,Tiger shark,siglo XXI,"No injury, shark bit scuba gear",28-Apr-2018,Apr,N,M,costa rica,2018.0
6,2018.04.25.a,australia,Western Australia,"Surfers Point, Prevelly",M,60,3 m shark,siglo XXI,"No injury, knocked off board by shark",25-Apr-2018,Apr,N,M,australia,2018.0
7,2018.04.23,maldives,Alifu Alifu Atoll,Madoogali,M,32,Tiger shark,siglo XXI,5-inch cut to hand,23-Apr-2018,Apr,N,M,maldives,2018.0
8,2018.04.22,south africa,Western Cape Province,"Robberg Beach, Plettenberg Bay",M,33,"White shark, 2.5 m",siglo XXI,"No injury, shark bit hole in ski",22-Apr-2018,Apr,N,M,south africa,2018.0
9,2018.04.03,south africa,Eastern Cape Province,St. Francis Bay,M,19,White shark,siglo XXI,Lacerations to left knee & lower leg,03-Apr-2018,Apr,N,M,south africa,2018.0
10,2018.03.31,usa,Hawaii,Kukio Beach,M,25,"Tiger shark, 12'",siglo XXI,Injuries to right leg & hand,31-Mar-2018,Mar,N,M,usa,2018.0
11,2018.03.14,australia,Western Australia,Waterman's Bay,M,10,Wobbegong shark,siglo XXI,Minor injuries to legs,14-Mar-2018,Mar,N,M,australia,2018.0
12,2018.03.09.b,australia,Victoria,Lorne,M,69,3.5 m shark,siglo XXI,"No injury, said to have been charged by sharks several times",9-Mar-2018,Mar,N,M,australia,2018.0
13,2018.03.09.a,australia,Victoria,Winkipop,M,18,1.8 m shark,siglo XXI,"Minor injury, ankle grazed",9-Mar-2018,Mar,N,M,australia,2018.0
14,2018.02.23,australia,New South Wales,"Little Congwong Beach, La Perouse ",F,55,"Juvenile white shark,  2.7 to 3.2 m",siglo XXI,Laceratons to right leg & foot,23-Feb-2018,Feb,N,F,australia,2018.0
15,2018.02.15,australia,New South Wales,"Surf Beach, Kiama",M,35,"Bull shark, 2 m",siglo XXI,Puncture wounds to leff foot & lower leg,15-Feb-2018,Feb,N,M,australia,2018.0
16,2018.01.12,brazil,Fernando de Noronha,Conceicao Beach,M,20,small shark,siglo XXI,Minor injury to left forearm,12-Jan-2018,Jan,N,M,brazil,2018.0
17,2017.12.31,usa,Hawaii,"Hultin's Beach, Oahu",F,54,Tiger shark,siglo XXI,Severe lacerations to left thigh & knee,31-Dec-2017,Dec,N,F,usa,2017.0
18,2017.11.24,usa,California,"Stillwater Cove, Monterey County",M,25,"White shark, 4.6 m",siglo XXI,Right leg bitten,24-Nov-2017,Nov,N,M,usa,2017.0
19,2017.11.13,australia,New South Wales,Avoca Beach,M,25,2 m shark,siglo XXI,Puncture wounds to left shoulder,13-Nov-2017,Nov,N,M,australia,2017.0
20,2017.11.04,cuba,Holquin Province,Guardalavaca Beach,M,22,Tiger shark,siglo XXI,FATAL,04-Nov-2017,Nov,Y,M,cuba,2017.0
21,2017.10.28,australia,New South Wales,Birubi Point,M,31,"Wobbegong shark, 1 m",siglo XXI,Minor injury to foot,28-Oct-2017,Oct,N,M,australia,2017.0
22,2017.10.22,australia,South Australia,Normanville,F,15,"White shark, 4.5 m",siglo XXI,Minor injuries,22-Oct-2017,Oct,N,F,australia,2017.0
23,2017.10.09,usa,Hawaii,"Davidsons Beach, Kekaha, Kauai",M,54,"Tiger shark, 8 to 10 feet",siglo XXI,Lacerations to left hand,09-Oct-2017,Oct,N,M,usa,2017.0
24,2017.10.05,usa,Hawaii,"Kamaole Beach Park, Maui ",F,40,8' shark,siglo XXI,Abrasions,05-Oct-2017,Oct,N,F,usa,2017.0
25,2017.09.24.b,usa,New York,Rockaway,M,33,Questionable,siglo XXI,"Lacerations to right ankle, foot & toe",24-Sep-2017,Sep,,M,usa,2017.0
26,2017.09.13,usa,Florida,"Ponce Inlet, Volusia County",M,18,5' to 6' shark,siglo XXI,Lacerations to left foot,13-Sep-2017,Sep,N,M,usa,2017.0
27,2017.09.10.a,australia,New South Wales,Iluka Beach,M,35,"White shark, 3 to 3.5m ",siglo XXI,Minor lacerations to right hip,10-Sep-2017,Sep,N,M,australia,2017.0
28,2017.08.29,australia,Victoria,Cathedral Rock,M,37,"White shark, 3 m",siglo XXI,"No injury, board bitten",29-Aug-2017,Aug,N,M,australia,2017.0
29,2017.08.26.b,spain,Castellón,Grao de Moncofa,F,11,Shark involvement questionable,siglo XXI,Lacerations to left foot,26-Aug-2017,Aug,,F,spain,2017.0
30,2017.08.23,usa,Massachusetts,"Marconi Beach, Wellfleet, Barnstable County",M,69,"White shark, 5' to 7'",siglo XXI,Not injured by shark but board bitten,23-Aug-2017,Aug,N,M,usa,2017.0
31,2017.08.10,usa,South Carolina,"Sea Pines Resort, Hilton Head Island, Beaufort County",M,13,Possibly a juvenile blacktip shark,siglo XXI,Minor cuts to sole & toes of left foot,10-Aug-2017,Aug,N,M,usa,2017.0
32,2017.08.03,usa,Massachusetts,"Menauhant Beach, Falmouth,
Barnstable County",M,34,4' shark,siglo XXI,Foot bitten by landed shark PROVOKED INCIDENT,03-Aug-2017,Aug,N,M,usa,2017.0
33,2017.07.29.c,usa,South Carolina,"Hilton Head Island, Beaufort County",M,10,A small shark,siglo XXI,Abrasions and cuts to sole of foot,29-Jul-2017,Jul,,M,usa,2017.0
34,2017.07.20.b,usa,California,"Stearns Wharf, Santa Barbara",M,40,"White shark, 11' to 13'",siglo XXI,"No injury, kayak bitten",20-Jul-2017,Jul,N,M,usa,2017.0
35,2017.07.20.a,usa,California,"Seal Rock, Goleta Beach, Santa Barbara",M,50,"White shark, 8' to 10'",siglo XXI,"No injury, shark bit paddleboard",20-Jul-2017,Jul,N,M,usa,2017.0
36,2017.07.09,usa,Florida,"Haulover Beach, Miami-Dade County",M,46,"Bull shark, 4' to 5'",siglo XXI,Lower legs bitten,09-Jul-2017,Jul,N,M,usa,2017.0
37,2017.07.07,south africa,Eastern Cape Province,"Nahoon Reef, East London",F,13,"White shark, 2.5 m",siglo XXI,"No injury, shark bit surfboard",07-Jul-2017,Jul,N,F,south africa,2017.0
38,2017.06.11,australia,Western Australia,"Point Casuarina, Bunbury",M,48,"White shark, 4 m",siglo XXI,"No injury, board bitten",11-Jun-2017,Jun,N,M,australia,2017.0
39,2017.06.02,bahamas,New Providence ,Athol Island,F,32,Tiger shark,siglo XXI,Right forearm severed ,02-Jun-2017,Jun,N,F,bahamas,2017.0
40,2017.05.03,usa,California,"Sunset Beach, Orange County",F,18,Shark involvement highly doubtful,siglo XXI,"Laceration to thigh, likely caused by surfboard fin",03-May-2017,May,,F,usa,2017.0
41,2017.04.17.a,australia,Western Australia,Kelpies near Wylie Bay,F,17,White shark,siglo XXI,FATAL,17-Apr-2017,Apr,Y,F,australia,2017.0
42,2017.04.14,usa,Hawaii,"Kekaha Beach, Kauai",M,28,"Tiger shark, 12'",siglo XXI,Lower right leg severely injured,14-Apr-2017,Apr,N,M,usa,2017.0
43,2017.04.02.a,usa,Florida,"Destin, Okaloosa County",F,17,"Bull shark, 5' to 7'",siglo XXI,Lacerations to thighs,02-Apr-2017,Apr,N,F,usa,2017.0
44,2017.01.21,australia,Queensland,"Boot Reef, Torres Strait",M,55,"Bull shark, 4 m",siglo XXI,"Multiple injuries to arm, wrist and torso",21-Jan-2017,Jan,N,M,australia,2017.0
45,2017.01.09,indonesia,Bali,Balian Beach,M,48,"Bull shark, 1 m",siglo XXI,Injury to right wrist & forearm,09-Jan-2017,Jan,N,M,indonesia,2017.0
46,2017.01.03,australia,New South Wales,Merimbula,M,20,Shark involvement not confirmed,siglo XXI,Minor injuries to foot & toes,03-Jan-2017,Jan,,M,australia,2017.0
47,2016.12.19,south africa,Western Cape Province,"Keurbooms Lagoon, Plettenberg Bay",M,55,"White shark, 4 m",siglo XXI,"No injury, but ski severely damaged",19-Dec-2016,Dec,N,M,south africa,2016.0
48,2016.12.11.a,usa,Florida,"New Smyrna Beach, Volusia County",M,19,Shark involvement not confirmed,siglo XXI,Cuts to right ankle & foot,11-Dec-2016,Dec,,M,usa,2016.0
49,2016.12.06,australia,New South Wales,Merimbula,M,20,"Wobbegong shark, 2m",siglo XXI,Lacerations to both hands while attempting to land a hooked shark PROVOKED INCIDENT,06-Dec-2016,Dec,N,M,australia,2016.0
50,2016.12.01,australia,New South Wales,Booti Booti National Park,M,65,White shark,siglo XXI,Injuries to foot & arm,01-Dec-2016,Dec,N,M,australia,2016.0
51,2016.11.28,australia,Victoria,Queenscliff,M,73,"Broadnose sevengill shark, 1.5 m",siglo XXI,Laceration to right hand by hooked & gaffed shark. PROVOKED INCIDENT,28-Nov-2016,Nov,N,M,australia,2016.0
52,2016.11.14,usa,Hawaii,"Kamaole Beach Park I, Maui",F,58,Tiger shark,siglo XXI,Injuries to right calf and thigh,14-Nov-2016,Nov,N,F,usa,2016.0
53,2016.10.21,usa,Hawaii,"Hooipa Beach Park, Maui",M,36, 6' to 8' shark,siglo XXI,Left arm and leg injured,21-Oct-2016,Oct,N,M,usa,2016.0
54,2016.09.26,australia,New South Wales,"Lighthouse Beach, Ballina",M,17,"White shark, 3.5 m",siglo XXI,4 deep lacerations to thigh,26-Sep-2016,Sep,N,M,australia,2016.0
55,2016.09.11,usa,Florida,"Ponte Vedra, St. Johns County",M,60s,3' to 4' shark,siglo XXI,Minor injury to arm,11-Sep-2016,Sep,N,M,usa,2016.0
56,2016.09.07,usa,Hawaii,"Makaha, Oahu",F,51,"Tiger shark, 10'",siglo XXI,Severe lacerations to shoulder & forearm,07-Sep-2016,Sep,N,F,usa,2016.0
57,2016.08.29.b,usa,Florida,"New Smyrna Beach, Volusia County",M,25,"Bull shark, 6'",siglo XXI,Lacerations to right foot,29-Aug-2016,Aug,N,M,usa,2016.0
58,2016.08.06,usa,Hawaii,Maui,M,21,"Tiger shark, 10' ",siglo XXI,"No inury, shark & board collided",06-Aug-2016,Aug,N,M,usa,2016.0
59,2016.07.29,spain,Alicante Province,Arenales del Sol,M,40,Blue shark,siglo XXI,Lacerations to right hand,29-Jul-2016,Jul,N,M,spain,2016.0
60,2016.07.20,australia,Queensland,"20 k off The Spit, off the Gold Coast",M,31,"reef shark, 1m",siglo XXI,Laceration to left calf from hooked shark PROVOKED INCIDENT,20-Jul-2016,Jul,N,M,australia,2016.0
61,2016.07.15.b,usa,California,"Surfside, Orange County",M,61,"White shark, 10' to 12'",siglo XXI,"No injury, board damaged",15-Jul-2016,Jul,N,M,usa,2016.0
62,2016.07.07.b,usa,Massachusetts,"Off Gloucester, Essec County",M,59,dogfish shark,siglo XXI,Fin of hooked shark injured fisherman's forearm. . PROVOKED INCIDENT,07-Jul-2016,Jul,N,M,usa,2016.0
63,2016.07.04,australia,Queensland,Palm Cove ,M,34,Tawny nurse shark,siglo XXI,Right thigh injured by hooked pregnant female shark PROVOKED INCIDENT,04-Jul-2016,Jul,N,M,australia,2016.0
64,2016.06.21.b,usa,South Carolina,"North Myrtle Beach, Horry County",M,42,3' to 5' shark,siglo XXI,Lacerations and punctures to foot,21-Jun-2016,Jun,N,M,usa,2016.0
65,2016.06.14,usa,Texas,"Pirates Beach, Galveston",F,6,3' to 4' shark,siglo XXI,Injury to lower leg,14-Jun-2016,Jun,N,F,usa,2016.0
66,2016.06.11,usa,North Carolina,"Atlantic Beach, Emerald Isle, Carteret County",M,19,3' shark,siglo XXI,Laceration to wrist,11-Jun-2016,Jun,N,M,usa,2016.0
67,2016.06.07,usa,South Carolina,"Folly Beach, Charleston County",M,27,Said to involve an 8' shark but more likely damage caused by debris,siglo XXI,"No injury, board damaged",07-Jun-2016,Jun,,M,usa,2016.0
68,2016.06.05.a,australia,Western Australia,Mindarie,F,60,3+ m shark,siglo XXI,FATAL,05-Jun-2016,Jun,Y,F,australia,2016.0
69,2016.06.04,egypt,Suez,Ain Sokhna,M,23,Mako shark,siglo XXI,"Leg severely bitten, surgically amputated",04-Jun-2016,Jun,N,M,egypt,2016.0
70,2016.05.31,australia,Western Australia,"Falcon Beach, Mandurah",M,29,White shark,siglo XXI,FATAL,31-May-2016,May,Y,M,australia,2016.0
71,2016.05.29.a,usa,Florida,"Neptune, Duval County",M,13,5' shark,siglo XXI,Injury to posterior right leg,29-May-2016,May,N,M,usa,2016.0
72,2016.05.21.b,usa,Florida,"St. Petersburg, Pinellas County",F,22,"Bull shark, 4' to 5'",siglo XXI,Lacerations and puncture wounds to foot and ankle,21-May-2016,May,N,F,usa,2016.0
73,2016.05.18,usa,Florida,"Ponte Vedra, St. Johns County",M,48,"Blacktip shark, 4'",siglo XXI,Ankle bitten,18-May-2016,May,N,M,usa,2016.0
74,2016.05.15,usa,Florida,"Boca Raton, Palm Beach County",F,23,"Nurse shark, 2'",siglo XXI,Arm grabbed PROVOKED INCIDENT,15-May-2016,May,N,F,usa,2016.0
75,2016.05.02,new zealand,North Island,Cormandel,M,39,"Mako shark, 1.5 m [5'] ",siglo XXI,Foot bitten by landed shark PROVOKED INCIDENT,02-May-2016,May,N,M,new zealand,2016.0
76,2016.04.25,indonesia,Bali,Balian,M,24,"Bull shark, 6'",siglo XXI,Elbow bitten,25-Apr-2016,Apr,N,M,indonesia,2016.0
77,2016.04.19,australia,New South Wales,"First Sun Beach, Byron Bay",M,12,Wobbegong shark,siglo XXI,Minor puncture wound to foot,19-Apr-2016,Apr,N,M,australia,2016.0
78,2016.04.18.b,french polynesia,Tuamotos,Makemo Atoll,M,22,"Grey reef shark, 2 m",siglo XXI,Laceration to knee by speared shark PROVOKED INCIDENT,18-Apr-2016,Apr,,M,french polynesia,2016.0
79,2016.04.18.a,french polynesia,Tuamotos,Makemo Atoll,M,26,"Grey reef shark, 2 m",siglo XXI,"Severe lacerations to right forearm, hand and calf from speared shark PROVOKED INCIDENT",18-Apr-2016,Apr,N,M,french polynesia,2016.0
80,2016.04.09,new caledonia,Grand Terre,Poe Beach,F,69,"Tiger shark, 2.5 m",siglo XXI,FATAL,09-Apr-2016,Apr,Y,F,new caledonia,2016.0
81,2016.01.23,usa,Hawaii,"Wailea Beach, Maui",M,48,"Tiger shark, 14'",siglo XXI,No injury,23-Jan-2016,Jan,N,M,usa,2016.0
82,2016.01.05,australia,Queensland,Heron Island,M,11,Blacktip shark,siglo XXI,Laceration to right calf,05-Jan-2016,Jan,N,M,australia,2016.0
83,2016.01.02,australia,Queensland,Miall Island,M,31,3 m shark,siglo XXI,Lacerations to arms & leg,02-Jan-2016,Jan,N,M,australia,2016.0
84,2015.12.22,usa,Hawaii,La'aloa Beach Park,M,71,9' shark,siglo XXI,"No injury, shark bit board",22-Dec-2015,Dec,N,M,usa,2015.0
85,2015.12.21.b,australia,New South Wales,Bondi Beach,M,43,"Bronze whaler shark, 6'",siglo XXI,"No injury, shark leapt on surfboard",21-Dec-2015,Dec,N,M,australia,2015.0
86,2015.11.20,ecuador,Galapagos Islands,"Punta Vicente Roca, Isabella Island",M,55,Galapagos shark,siglo XXI,Lacerations to left calf,20-Nov-2015,Nov,N,M,ecuador,2015.0
87,2015.11.10,australia,New South Wales,East Ballina,M,20,"Bull shark, 2.8 to 3.1 m",siglo XXI,Injury to left thigh,10-Nov-2015,Nov,N,M,australia,2015.0
88,2015.12.23,usa,Florida,"Paradise Beach, Melbourne, Brevard County",F,9,Shark involvement not confirmed,siglo XXI,Lower left leg injured,07-Nov-2015,Nov,,F,usa,2015.0
89,2015.11.01.b,usa,Florida,"Cocoa Beach, Brevard  County",F,28,3' to 5' shark,siglo XXI,Injury to right ankle/calf & hand,01-Nov-2015,Nov,N,F,usa,2015.0
90,2015.10.25,south africa,Western Cape Province,Stil Bay,M,42,"White shark, 3 to 3.5m ",siglo XXI,"Lacerations to right calf, knee & hip",25-Oct-2015,Oct,N,M,south africa,2015.0
91,2015.10.21,usa,Florida,"Playalinda Beach, Brevard County",M,21,5' shark,siglo XXI,Lacerations to left hand,21-Oct-2015,Oct,N,M,usa,2015.0
92,2015.10.19,usa,Florida,"Deerfield Beach, Broward County",M,21,"Spinner shark, 5'",siglo XXI,Left foot bitten,19-Oct-2015,Oct,N,M,usa,2015.0
93,2015.10.17.b,usa,Hawaii,"Waikiki, ",M,32,No shark involvement,siglo XXI,Left foot bitten by eel,17-Oct-2015,Oct,,M,usa,2015.0
94,2015.10.17.a,usa,Hawaii,"Lanikai Beach, Kailua, Oahu",M,44,"Tiger shark, 7'",siglo XXI,Severe injuries to lower legs. Foot later surgically amputated.,17-Oct-2015,Oct,N,M,usa,2015.0
95,2015.10.09.a,usa,Hawaii,"Leftovers, Oahu",M,25,"Tiger shark, 13' ",siglo XXI,"Left leg severed below the knee, defense injuries to left hand",09-Oct-2015,Oct,N,M,usa,2015.0
96,2015.10.05.a,usa,Texas,Galveston,M,13,4' to 5' shark,siglo XXI,Foot & hands bitten,05-Oct-2015,Oct,N,M,usa,2015.0
97,2015.10.04,usa,Florida,"New Smyrna Beach, Volusia County",M,14,"Blacktip shark, 4' to 5'",siglo XXI,Severe lacerations to left hand,04-Oct-2015,Oct,N,M,usa,2015.0
98,2015.09.29,usa,Florida,"Vilano Beach, St.  Johns County",M,22,"Blacktip shark, 5' to 6'",siglo XXI,"Laceration to heel, puncture wounds to dorsum of foot",29-Sep-2015,Sep,N,M,usa,2015.0
99,2015.09.20.d,usa,Florida,"New Smyrna Beach, Volusia County",M,14,juvenile shark,siglo XXI,Minor injury to left ankle,20-Sep-2015,Sep,N,M,usa,2015.0
100,2015.09.20.c,usa,Hawaii,"Upolu Point, North Kohala, Big Island",M,27,"Tiger shark, 13'",siglo XXI,Severe laceration to left leg,20-Sep-2015,Sep,N,M,usa,2015.0
101,2015.09.20.b,usa,Florida,"Fernandina Beach, Amelia Island, Nassau County",M,12,4' shark,siglo XXI,Significant injuries to leg,20-Sep-2015,Sep,N,M,usa,2015.0
102,2015.09.08,australia,New South Wales,North Shelly Beach,M,42,6' shark,siglo XXI,Minor laceration to hand,08-Sep-2015,Sep,N,M,australia,2015.0
103,2015.09.06,usa,California,"El Pescador Beach, Los Angeles County",F,50,"White shark, 11' to 12'",siglo XXI,"No injury, shark struck board, tossing her into the sea",06-Sep-2015,Sep,N,F,usa,2015.0
104,2015.09.05,usa,California,"Deer Creek Beach, Ventura County",M,29,Hammerhead shark.,siglo XXI,Laceration to dorsum of foot by hooked shark  PROVOKED INCIDENT,05-Sep-2015,Sep,N,M,usa,2015.0
105,2015.09.04,australia,New South Wales,Hallidays Point,M,62,"White shark, 2.5 m",siglo XXI,Inuries to lower left leg & ankle,04-Sep-2015,Sep,N,M,australia,2015.0
106,2015.09.01,thailand,Phuket,Karon Beach,F,37,small shark,siglo XXI,Left foot & ankle bitten,01-Sep-2015,Sep,N,F,thailand,2015.0
107,2015.08.29.b,usa,California,"Morro Strand State Beach, San Luis Obispo County",F,54,"White shark, 11' to 12'",siglo XXI,"No injury, surfboard bitten",29-Aug-2015,Aug,N,F,usa,2015.0
108,2015.08.29.a,usa,California,"Morro Bay, San Luis Obispo County",M,21,"White shark, 10' to 12' ",siglo XXI,"No injury, shark struk sufer's leg and his board",29-Aug-2015,Aug,N,M,usa,2015.0
109,2015.08.20,usa,South Carolina,"Murrells Inlet, Georgetown County",M,15,4' shark,siglo XXI,"Injuries to left calf, arm and hand",20-Aug-2015,Aug,N,M,usa,2015.0
110,2015.08.19,usa,Florida,"Jacksonville Beach, Duval County",F,10,3' shark,siglo XXI,Lacerations to right leg,19-Aug-2015,Aug,N,F,usa,2015.0
111,2015.08.18.b,usa,California,Santa Barbara County,M,22,"White shark, 13'",siglo XXI,"No injury, kayak bitten",18-Aug-2015,Aug,N,M,usa,2015.0
112,2015.08.18.a,spain,Alicante,"Poniente Beach, Benidorm",M,10,Shark involvement not confirmed,siglo XXI,Minor injury when he attempted to touch a fish. ,18-Aug-2015,Aug,,M,spain,2015.0
113,2015.08.10,usa,California,Cortes Bank,M,57,Hammerhead shark. 6' to 7',siglo XXI,Right hand bitten  PROVOKED INCIDENT,10-Aug-2015,Aug,N,M,usa,2015.0
114,2015.07.31,australia,New South Wales,Evans Head,M,52,White shark,siglo XXI,"Lacerations and puncture wounds to hip, thigh, arm and hand",31-Jul-2015,Jul,N,M,australia,2015.0
115,2015.07.26.b,usa,Florida,"Daytona Beach, Volusia County",M,25,"Blacktip or spinner shark, 4'",siglo XXI,Minor injury to sole of foot,26-Jul-2015,Jul,N,M,usa,2015.0
116,2015.07.26.a,usa,South Carolina,"Edisto Beach, Colleton County",F,35,"Thought to involve a 3' to 4' shark, but shark involvement not confirmed",siglo XXI,"2' cut to dorsum of foot, 2 puncture wounds to sole",26-Jul-2015,Jul,,F,usa,2015.0
117,2015.07.25,australia,Tasmania,"Lachan Island, Mercury Passage",M,46,"White shark, 3.9 to 4.2 m",siglo XXI,FATAL,25-Jul-2015,Jul,Y,M,australia,2015.0
118,2015.07-10,usa,California,"Huntington Beach, Orange County",M,38,"White shark, 7'",siglo XXI,"No injury, shark bumped & damaged board",10-Jul-2015,Jul,N,M,usa,2015.0
119,2015.07.03,australia,New South Wales,Lennox Head,M,52,White shark,siglo XXI,"No injury, shark bit surfboard",03-Jul-2015,Jul,N,M,australia,2015.0
120,2015.07.02,australia,New South Wales,East Ballina,M,32,White shark,siglo XXI,Significant injuries to lower legs,02-Jul-2015,Jul,N,M,australia,2015.0
121,2015.07.01,usa,North Carolina,"Ocracoke, Lifeguard Beach, National Park Service, Hyde County",M,68,6' to 7' shark,siglo XXI,"Injuries to torso, hip, lower leg & hands",01-Jul-2015,Jul,N,M,usa,2015.0
122,2015.06.30.a,usa,South Carolina,"Isle of Palms County Park, Isle of Palms, Charleston County",M,12,4' to 5' shark,siglo XXI,Shallow lacerations & puncture to lateral left leg,30-Jun-2015,Jun,N,M,usa,2015.0
123,2015.06.27.b,usa,North Carolina,"Rodanthe, Dare County",M,18,Bull shark,siglo XXI,"Injuries to right calf, buttock and both hands",27-Jun-2015,Jun,N,M,usa,2015.0
124,2015.06.27.a,south africa,Western Cape Province,Buffels Bay near Knysna,M,19,White shark,siglo XXI,"Right leg severed, multiple lacerations to left leg",27-Jun-2015,Jun,N,M,south africa,2015.0
125,2015.06.26.b,south africa,Western Cape Province,"Lookout Beach, Plettenberg Bay",M,23,"White shark, 2m to 3 m",siglo XXI,Multiple lacerations to torso & leg,26-Jun-2015,Jun,N,M,south africa,2015.0
126,2015.06.26.a,usa,South Carolina,"South Beach, Hunting Island State Park, Beaufort County",M,43,4' shark,siglo XXI,Puncture wounds to foot,26-Jun-2015,Jun,N,M,usa,2015.0
127,2015.06.24.b,usa,North Carolina,Surf City,M,6,Sandtiger shark,siglo XXI,Minor injury to foot,24-Jun-2015,Jun,N,M,usa,2015.0
128,2015.06.24.a,australia,Western Australia,Denmark,F,37,White shark,siglo XXI,"Bruises and abrasions to face, chin, chest, both shins & feet and cut to right hand when her surfboard was struck with force",24-Jun-2015,Jun,N,F,australia,2015.0
129,2015.06.14.b,usa,North Carolina,"Oak Island, Brunswick County",M,16,Bull shark,siglo XXI,Arm amputated below shoulder,14-Jun-2015,Jun,N,M,usa,2015.0
130,2015.06.14.a,usa,North Carolina,"Oak Island, Brunswick County",F,12,Bull shark,siglo XXI,Left arm amputated at elbow & severe injury to leg,14-Jun-2015,Jun,N,F,usa,2015.0
131,2015.06.11,usa,North Carolina,"Ocean Isle, Brunswick County",F,13,4' shark,siglo XXI,Minor lacerations to foot,11-Jun-2015,Jun,N,F,usa,2015.0
132,2015.06.07,usa,Florida,"Lori Wilson Park, Cocoa Beach, Brevard  County",M,11,"Bull shark, 5'",siglo XXI,Lacerations to right calf,07-Jun-2015,Jun,N,M,usa,2015.0
133,2015.06.01,reunion,Le Port,Folette,M,47,"Bull shark, 2.5 m",siglo XXI,Left forearm bitten,01-Jun-2015,Jun,N,M,reunion,2015.0
134,2015.05.25,french polynesia,Rangiroa,Avatoru Pass,M,19,1m to 1.2 m shark,siglo XXI,Lacerations to right forearm,25-May-2015,May,N,M,french polynesia,2015.0
135,2015.05.20,usa,Florida,"New Smyrna Beach, Volusia County",M,18,5' shark,siglo XXI,2 puncture wounds to  dorsum of left foot,20-May2015,,N,M,usa,2015.0
136,2015.05.02,south africa,Eastern Cape Province,Port St. John's,M,29,"White shark, 3.5 m",siglo XXI,"Injuries to leg, left arm & both hands",02-May-2015,May,N,M,south africa,2015.0
137,2015.04.26,usa,Florida,"Resident's Beach, Marco Island",M,63,3- to 4-foot shark,siglo XXI,Lacerations to left calf,26-Apr-2015,Apr,N,M,usa,2015.0
138,2015.04.25,australia,South Australia,Fishery Bay,M,26,"White shark, 6 m",siglo XXI,Leg severed at mid-thigh,25-Apr-2015,Apr,N,M,australia,2015.0
139,2015.04.24.c,australia,New South Wales,"Belongil Beach, Byron Bay",M,71,"White shark, 3 m",siglo XXI,"No injury, knocked off ski",24-Jun-2015,Jun,N,M,australia,2015.0
140,2015.04.12,reunion,Saint-Gilles-les-Bains,Cap Homard,M,13,Bull shark,siglo XXI,FATAL,12-Apr-2015,Apr,Y,M,reunion,2015.0
141,2015.04.03,usa,Florida,"3 miles off Jupiter, Palm Beach County",M,70,Bull shark,siglo XXI,Injuries to head & torso,03-Apr-2015,Apr,N,M,usa,2015.0
142,2015.03.31,brazil,Pernambuco,"Praia del Chifre, Olinda",M,23,No shark involvement,siglo XXI,Injury to left thigh from unidentified species of fish; injuries inconsistent with shark bite,31-Mar-2015,Mar,,M,brazil,2015.0
143,2015.03.18,usa,Hawaii,Hapuna Beach,M,58,"Tiger shark, 8 to 12 feet",siglo XXI,Lacerations to left forearm. Lacerations to left hand and thigh,18-Mar-2015,Mar,N,M,usa,2015.0
144,2015.03.16,french polynesia,Bora Bora,Anau,M,9,Blacktip shark,siglo XXI,Hand bitten,16-Mar-2015,Mar,N,M,french polynesia,2015.0
145,2015.02.14,reunion,dÉtang-Salé,Ravine Mula,F,22,"Tiger shark, 3.5 m",siglo XXI,FATAL,14-Feb-2015,Feb,Y,F,reunion,2015.0
146,2015.02.09,australia,New South Wales,Shelly Beach,M,41,3.5 to 4 m shark,siglo XXI,FATAL,09-Feb-2015,Feb,Y,M,australia,2015.0
147,2015.02.08,australia,New South Wales,"Seven Mile Beach, Byron Bay",M,35,2 m to  3 m shark,siglo XXI,Laceration & puncture wounds to right flank & hip,08-Feb-2015,Feb,N,M,australia,2015.0
148,2015.01.30,australia,Queensland,"Nerang River, Surfer's  Paradise",M,57,"Bull shark, 1.3 m",siglo XXI,"No injury, shark's teeth scratched hull",30-Jan-2015,Jan,N,M,australia,2015.0
149,2015.01.27,usa,Hawaii,Lahaina,M,20,4' shark,siglo XXI,Lacerations to calf by hooked shark PROVOKED INCIDENT,27-Jan-2015,Jan,N,M,usa,2015.0
150,2015.01.06,bahamas,Abaco Islands,"Tahiti Beach, Elbow Cay",F,34,White shark or oceanic whitetip shark,siglo XXI,Severe bite to right flank,06-Jan-2015,Jan,N,F,bahamas,2015.0
151,2015.01.03,south africa,Eastern Cape Province,Chintsa East Beach,M,15,"Raggedtooth shark, 1.3 m",siglo XXI,"Lacerations to lower left leg, puncture wounds to sole of left foot",03-Jan-2015,Jan,N,M,south africa,2015.0
152,2014.12.29.a,australia,Western Australia,Three Stripes near Cheynes Beach,M,17,"White shark, 4 to 5 m",siglo XXI,FATAL,29-Dec-2014,Dec,Y,M,australia,2014.0
153,2014.12.28.b,usa,California,"Montaña de Oro State Park, San Luis Obispo County ",M,50,"White shark, 8' to 10'",siglo XXI,Injury to hip/leg,28-Dec-2014,Dec,N,M,usa,2014.0
154,2014.12.28.a,australia,Victoria,Paradise Beach,M,40s,1.5 m shark,siglo XXI,Laceration to calf when he fell on shark he had caught PROVOKED INCIDENT,28-Dec-2014,Dec,N,M,australia,2014.0
155,2014.12.15,australia,Queensland,Rudder Reef,M,17,Tiger shark,siglo XXI,FATAL,15-Dec-2014,Dec,Y,M,australia,2014.0
156,2014.11.16,usa,Florida,"Indian Harbor Beach, Brevard County",M,44,2' shark,siglo XXI,Laceration to left hand,16-Nov-2014,Nov,N,M,usa,2014.0
157,2014.11.13,usa,Hawaii,"Airplane Beach, Lahina, West Maui",M,53,1.5 m shark,siglo XXI,Laceration to left upper leg,13-Nov-2014,Nov,N,M,usa,2014.0
158,2014.10.31,usa,Hawaii,"North Kohala, Hawaii County",F,34,"Tiger shark, 12'",siglo XXI,Lacerations to fingers,31-Oct-2014,Oct,N,F,usa,2014.0
159,2014.10.17,australia,New South Wales,Avoca Beach,F,13,1 m shark,siglo XXI,"Lacerations to left calf & ankle, puncture wounds to left foot",17-Oct-2014,Oct,N,F,australia,2014.0
